VPR FPGA Placement and Routing.
Version: 8.1.0-dev+dadca7ecf
Revision: v8.0.0-rc2-2894-gdadca7ecf
Compiled: 2021-01-14T13:13:16
Compiler: GNU 9.3.0 on Linux-5.4.0-faked aarch64
Build Info: release IPO VTR_ASSERT_LEVEL=2

University of Toronto
verilogtorouting.org
vtr-users@googlegroups.com
This is free open source code under MIT license.

VPR was run with the following command-line:
vpr /root/symbiflow/quicklogic-arch-defs/share/arch/ql-eos-s3_wlcsp/arch.timing.xml helloworldfpga.eblif --device ql-eos-s3 --max_router_iterations 500 --routing_failure_predictor off --router_high_fanout_threshold -1 --constant_net_method route --route_chan_width 100 --clock_modeling route --place_delay_model delta_override --router_lookahead map --check_route quick --strict_checks off --allow_dangling_combinational_nodes on --disable_errors check_unbuffered_edges:check_route --congested_routing_iteration_threshold 0.8 --incremental_reroute_delay_ripup off --base_cost_type delay_normalized_length_bounded --bb_factor 10 --initial_pres_fac 4.0 --check_rr_graph off --suppress_warnings ,sum_pin_class:check_unbuffered_edges:load_rr_indexed_data_T_values:check_rr_node:trans_per_R:check_route:set_rr_graph_tool_comment:warn_model_missing_timing --read_rr_graph /root/symbiflow/quicklogic-arch-defs/share/arch/ql-eos-s3_wlcsp/rr_graph_ql-eos-s3_wlcsp.rr_graph.real.bin --read_placement_delay_lookup /root/symbiflow/quicklogic-arch-defs/share/arch/ql-eos-s3_wlcsp/rr_graph_ql-eos-s3_wlcsp.place_delay.bin --sdc_file /storage/emulated/0/github/vaman/sevenseg/codes/loop/build/helloworldfpga_dummy.sdc --route


Architecture file: /root/symbiflow/quicklogic-arch-defs/share/arch/ql-eos-s3_wlcsp/arch.timing.xml
Circuit name: helloworldfpga

# Loading Architecture Description
# Loading Architecture Description took 0.45 seconds (max_rss 26.9 MiB, delta_rss +23.7 MiB)
# Building complex block graph
# Building complex block graph took 0.09 seconds (max_rss 33.7 MiB, delta_rss +6.7 MiB)
# Load circuit
# Load circuit took 0.01 seconds (max_rss 35.5 MiB, delta_rss +1.9 MiB)
# Clean circuit
Absorbed 1144 LUT buffers
Inferred  106 additional primitive pins as constant generators since they have no combinationally connected inputs
Inferred   44 additional primitive pins as constant generators due to constant inputs
Inferred    0 additional primitive pins as constant generators since they have no combinationally connected inputs
Inferred    0 additional primitive pins as constant generators due to constant inputs
Inferred    0 additional primitive pins as constant generators since they have no combinationally connected inputs
Inferred    0 additional primitive pins as constant generators due to constant inputs
Swept input(s)      : 0
Swept output(s)     : 0 (0 dangling, 0 constant)
Swept net(s)        : 141
Swept block(s)      : 1
Constant Pins Marked: 150
# Clean circuit took 0.01 seconds (max_rss 36.6 MiB, delta_rss +1.0 MiB)
# Compress circuit
# Compress circuit took 0.00 seconds (max_rss 36.6 MiB, delta_rss +0.0 MiB)
# Verify circuit
# Verify circuit took 0.00 seconds (max_rss 36.6 MiB, delta_rss +0.0 MiB)
Circuit Statistics:
  Blocks: 156
    .output   :       7
    ASSP      :       1
    BIDIR_CELL:       7
    C_FRAG    :      20
    F_FRAG    :       1
    GND       :       1
    Q_FRAG    :      35
    T_FRAG    :      83
    VCC       :       1
  Nets  : 149
    Avg Fanout:     8.6
    Max Fanout:   541.0
    Min Fanout:     1.0
  Netlist Clocks: 1
# Build Timing Graph
  Timing Graph Nodes: 1427
  Timing Graph Edges: 2311
  Timing Graph Levels: 28
# Build Timing Graph took 0.00 seconds (max_rss 36.6 MiB, delta_rss +0.0 MiB)
Netlist contains 1 clocks
  Netlist Clock 'clk' Fanout: 35 pins (2.5%), 35 blocks (22.4%)
# Load Timing Constraints

SDC file '/storage/emulated/0/github/vaman/sevenseg/codes/loop/build/helloworldfpga_dummy.sdc' contained no SDC commands
Setting default timing constraints:
   * constrain all primay inputs and primary outputs on netlist clock 'clk'
   * optimize netlist clock to run as fast as possible
Timing constraints created 1 clocks
  Constrained Clock 'clk' Source: 'u_qlal4s3b_cell_macro.Sys_Clk0[0]'

# Load Timing Constraints took 0.00 seconds (max_rss 36.6 MiB, delta_rss +0.0 MiB)
Timing analysis: ON
Circuit netlist file: helloworldfpga.net
Circuit placement file: helloworldfpga.place
Circuit routing file: helloworldfpga.route
Circuit SDC file: /storage/emulated/0/github/vaman/sevenseg/codes/loop/build/helloworldfpga_dummy.sdc

Packer: ENABLED
Placer: ENABLED
Router: ENABLED
Analysis: ENABLED

NetlistOpts.abosrb_buffer_luts            : true
NetlistOpts.sweep_dangling_primary_ios    : true
NetlistOpts.sweep_dangling_nets           : true
NetlistOpts.sweep_dangling_blocks         : true
NetlistOpts.sweep_constant_primary_outputs: false
NetlistOpts.netlist_verbosity             : 1
NetlistOpts.const_gen_inference           : COMB_SEQ

PackerOpts.allow_unrelated_clustering: auto
PackerOpts.alpha_clustering: 0.750000
PackerOpts.beta_clustering: 0.900000
PackerOpts.cluster_seed_type: BLEND2
PackerOpts.connection_driven: true
PackerOpts.global_clocks: true
PackerOpts.hill_climbing_flag: false
PackerOpts.inter_cluster_net_delay: 1.000000
PackerOpts.timing_driven: true
PackerOpts.target_external_pin_util: auto

PlacerOpts.place_freq: PLACE_ONCE
PlacerOpts.place_algorithm: CRITICALITY_TIMING_PLACE
PlacerOpts.pad_loc_type: FREE
PlacerOpts.constraints_file: No constraints file given
PlacerOpts.place_cost_exp: 1.000000
PlacerOpts.place_chan_width: 100
PlacerOpts.inner_loop_recompute_divider: 0
PlacerOpts.recompute_crit_iter: 1
PlacerOpts.timing_tradeoff: 0.500000
PlacerOpts.td_place_exp_first: 1.000000
PlacerOpts.td_place_exp_last: 8.000000
PlacerOpts.delay_offset: 0.000000
PlacerOpts.delay_ramp_delta_threshold: -1
PlacerOpts.delay_ramp_slope: 0.000000
PlacerOpts.tsu_rel_margin: 1.000000
PlacerOpts.tsu_abs_margin: 0.000000
PlacerOpts.post_place_timing_report_file: 
PlacerOpts.allowed_tiles_for_delay_model: 
PlacerOpts.delay_model_reducer: MIN
PlacerOpts.delay_model_type: DELTA_OVERRIDE
PlacerOpts.rlim_escape_fraction: 0.000000
PlacerOpts.move_stats_file: 
PlacerOpts.placement_saves_per_temperature: 0
PlacerOpts.effort_scaling: CIRCUIT
PlacerOpts.place_delta_delay_matrix_calculation_method: ASTAR_ROUTE
PlaceOpts.seed: 1
AnnealSched.type: AUTO_SCHED
AnnealSched.inner_num: 1.000000

RouterOpts.route_type: DETAILED
RouterOpts.router_algorithm: TIMING_DRIVEN
RouterOpts.base_cost_type: DELAY_NORMALIZED_LENGTH_BOUNDED
RouterOpts.fixed_channel_width: 100
RouterOpts.check_route: QUICK
RouterOpts.trim_empty_chan: false
RouterOpts.trim_obs_chan: false
RouterOpts.acc_fac: 1.000000
RouterOpts.bb_factor: 10
RouterOpts.bend_cost: 0.000000
RouterOpts.first_iter_pres_fac: 0.000000
RouterOpts.initial_pres_fac: 4.000000
RouterOpts.pres_fac_mult: 1.300000
RouterOpts.max_router_iterations: 500
RouterOpts.min_incremental_reroute_fanout: 16
RouterOpts.do_check_rr_graph: false
RouterOpts.verify_binary_search: false
RouterOpts.min_channel_width_hint: 0
RouterOpts.read_rr_edge_metadata: false
RouterOpts.exit_after_first_routing_iteration: false
RouterOpts.astar_fac: 1.200000
RouterOpts.criticality_exp: 1.000000
RouterOpts.max_criticality: 0.990000
RouterOpts.init_wirelength_abort_threshold: 0.850000
RouterOpts.save_routing_per_iteration: false
RouterOpts.congested_routing_iteration_threshold_frac: 0.800000
RouterOpts.high_fanout_threshold: -1
RouterOpts.router_debug_net: -2
RouterOpts.router_debug_sink_rr: -2
RouterOpts.router_debug_iteration: -2
RouterOpts.max_convergence_count: 1
RouterOpts.reconvergence_cpd_threshold: 0.990000
RouterOpts.update_lower_bound_delays: true
RouterOpts.first_iteration_timing_report_file: 
RouterOpts.incr_reroute_delay_ripup: OFF
RouterOpts.route_bb_update: DYNAMIC
RouterOpts.lookahead_type: MAP
RouterOpts.initial_timing: LOOKAHEAD
RouterOpts.router_heap: BINARY_HEAP
RouterOpts.routing_failure_predictor = OFF
RouterOpts.routing_budgets_algorithm = DISABLE

AnalysisOpts.gen_post_synthesis_netlist: false
AnalysisOpts.timing_report_npaths: 100
AnalysisOpts.timing_report_skew: false
AnalysisOpts.echo_dot_timing_graph_node: -1
AnalysisOpts.timing_report_detail: NETLIST

RoutingArch.directionality: BI_DIRECTIONAL
RoutingArch.switch_block_type: WILTON
RoutingArch.Fs: 3

# Load Packing
Begin loading packed FPGA netlist file.
Netlist generated from file 'helloworldfpga.net'.
Detected 2 constant generators (to see names run with higher pack verbosity)
Finished loading packed FPGA netlist file (took 0.031541 seconds).
# Load Packing took 0.03 seconds (max_rss 37.7 MiB, delta_rss +1.2 MiB)
Warning 1: Netlist contains 0 global net to non-global architecture pin connections
Warning 2: Logic block #70 ($false) has only 1 output pin '$false.GND0_GND[0]'. It may be a constant generator.
Warning 3: Logic block #71 ($true) has only 1 output pin '$true.VCC0_VCC[0]'. It may be a constant generator.

Netlist num_nets: 113
Netlist num_blocks: 72
Netlist EMPTY blocks: 0.
Netlist PB-GMUX blocks: 0.
Netlist PB-LOGIC blocks: 62.
Netlist PB-CLOCK blocks: 0.
Netlist PB-MULT blocks: 0.
Netlist PB-SDIOMUX blocks: 0.
Netlist PB-RAM blocks: 0.
Netlist PB-SYN_VCC blocks: 1.
Netlist PB-BIDIR blocks: 7.
Netlist PB-SYN_GND blocks: 1.
Netlist PB-ASSP blocks: 1.
Netlist inputs pins: 0
Netlist output pins: 21


Pb types usage...
  PB-LOGIC          : 62
   LOGIC            : 62
    FRAGS           : 62
     c_frag_modes   : 62
      SINGLE        : 20
       c_frag       : 20
      SPLIT         : 42
       b_frag       : 42
       t_frag       : 41
     f_frag         : 1
     q_frag_modes   : 35
      INT           : 29
       q_frag       : 29
      EXT           : 6
       q_frag       : 6
  PB-SYN_VCC        : 1
   VCC              : 1
  PB-BIDIR          : 7
   BIDIR            : 7
    OUTPUT          : 7
     bidir          : 7
     outpad         : 7
  PB-SYN_GND        : 1
   GND              : 1
  PB-ASSP           : 1
   ASSP             : 1

# Create Device
## Build Device Grid
FPGA sized to 39 x 35: 1365 grid tiles (ql-eos-s3)

Resource usage...
	Netlist
		0	blocks of type: PB-GMUX
	Architecture
		5	blocks of type: TL-GMUX
	Netlist
		62	blocks of type: PB-LOGIC
	Architecture
		891	blocks of type: TL-LOGIC
	Netlist
		0	blocks of type: PB-CLOCK
	Architecture
		5	blocks of type: TL-CLOCK
	Netlist
		0	blocks of type: PB-MULT
	Architecture
		2	blocks of type: TL-MULT
	Netlist
		0	blocks of type: PB-SDIOMUX
	Architecture
		14	blocks of type: TL-SDIOMUX
	Netlist
		0	blocks of type: PB-RAM
	Architecture
		4	blocks of type: TL-RAM
	Netlist
		1	blocks of type: PB-SYN_VCC
	Architecture
		1	blocks of type: TL-SYN_VCC
	Netlist
		7	blocks of type: PB-BIDIR
	Architecture
		32	blocks of type: TL-BIDIR
	Netlist
		1	blocks of type: PB-SYN_GND
	Architecture
		1	blocks of type: TL-SYN_GND
	Netlist
		1	blocks of type: PB-ASSP
	Architecture
		1	blocks of type: TL-ASSP

Device Utilization: 0.05 (target 1.00)
	Physical Tile TL-LOGIC:
	Block Utilization: 0.07 Logical Block: PB-LOGIC
	Physical Tile TL-RAM:
	Block Utilization: 0.00 Logical Block: PB-RAM
	Physical Tile TL-MULT:
	Block Utilization: 0.00 Logical Block: PB-MULT
	Physical Tile TL-BIDIR:
	Block Utilization: 0.22 Logical Block: PB-BIDIR
	Physical Tile TL-CLOCK:
	Block Utilization: 0.00 Logical Block: PB-CLOCK
	Physical Tile TL-SDIOMUX:
	Block Utilization: 0.00 Logical Block: PB-SDIOMUX
	Physical Tile TL-GMUX:
	Block Utilization: 0.00 Logical Block: PB-GMUX
	Physical Tile TL-ASSP:
	Block Utilization: 1.00 Logical Block: PB-ASSP
	Physical Tile TL-SYN_VCC:
	Block Utilization: 1.00 Logical Block: PB-SYN_VCC
	Physical Tile TL-SYN_GND:
	Block Utilization: 1.00 Logical Block: PB-SYN_GND

## Build Device Grid took 0.01 seconds (max_rss 37.8 MiB, delta_rss +0.0 MiB)
## Loading routing resource graph


## Loading routing resource graph took 0.57 seconds (max_rss 344.1 MiB, delta_rss +306.3 MiB)
  RR Graph Nodes: 1396446
  RR Graph Edges: 2337988
# Create Device took 1.79 seconds (max_rss 391.8 MiB, delta_rss +354.0 MiB)

# Load Placement
Reading helloworldfpga.place.

Successfully read helloworldfpga.place.

# Load Placement took 0.00 seconds (max_rss 391.8 MiB, delta_rss +0.0 MiB)

# Computing router lookahead map
## Computing wire lookahead
Warning 4: Unable to find any sample location for segment CHANX type 'generic' (length 1)
Warning 5: Unable to find any sample location for segment CHANY type 'generic' (length 1)
Warning 6: Unable to find any sample location for segment CHANX type 'pad' (length 1)
Warning 7: Unable to find any sample location for segment CHANY type 'pad' (length 1)
## Computing wire lookahead took 25.64 seconds (max_rss 391.8 MiB, delta_rss +0.0 MiB)
## Computing src/opin lookahead
## Computing src/opin lookahead took 0.00 seconds (max_rss 391.8 MiB, delta_rss +0.0 MiB)
# Computing router lookahead map took 25.64 seconds (max_rss 391.8 MiB, delta_rss +0.0 MiB)
# Routing
  RR Graph Nodes: 1396446
  RR Graph Edges: 2337988
Confirming router algorithm: TIMING_DRIVEN.
## Initializing router criticalities
Initial Net Connection Criticality Histogram:
[        0:      0.1) 757 ( 63.0%) |***********************************************
[      0.1:      0.2)   0 (  0.0%) |
[      0.2:      0.3)  58 (  4.8%) |****
[      0.3:      0.4)  31 (  2.6%) |**
[      0.4:      0.5)  29 (  2.4%) |**
[      0.5:      0.6)  32 (  2.7%) |**
[      0.6:      0.7)  28 (  2.3%) |**
[      0.7:      0.8)  54 (  4.5%) |***
[      0.8:      0.9) 115 (  9.6%) |*******
[      0.9:        1)  97 (  8.1%) |******
## Initializing router criticalities took 0.00 seconds (max_rss 450.3 MiB, delta_rss +0.0 MiB)
---- ------ ------- ---- ------- ------- ------- ----------------- --------------- -------- ---------- ---------- ---------- ---------- --------
Iter   Time    pres  BBs    Heap  Re-Rtd  Re-Rtd Overused RR Nodes      Wirelength      CPD       sTNS       sWNS       hTNS       hWNS Est Succ
      (sec)     fac Updt    push    Nets   Conns                                       (ns)       (ns)       (ns)       (ns)       (ns)     Iter
---- ------ ------- ---- ------- ------- ------- ----------------- --------------- -------- ---------- ---------- ---------- ---------- --------
   1    8.9     0.0    0 2.8e+07     113    1201    1518 ( 0.109%)   27938 ( 2.0%)   71.444     -2310.    -71.444      0.000      0.000      N/A
   2    6.1     4.0    0 1.8e+07      99     738     715 ( 0.051%)   28532 ( 2.0%)   71.522     -2313.    -71.522      0.000      0.000      N/A
   3    5.1     5.2    0 1.4e+07      73     492     410 ( 0.029%)   28586 ( 2.0%)   71.522     -2316.    -71.522      0.000      0.000      N/A
   4    3.3     6.8    0 9429648      56     373     238 ( 0.017%)   28696 ( 2.0%)   71.559     -2318.    -71.559      0.000      0.000      N/A
   5    2.1     8.8    0 6081360      42     241     150 ( 0.011%)   28905 ( 2.0%)   71.509     -2323.    -71.509      0.000      0.000      N/A
   6    2.0    11.4    0 5647990      30     172     105 ( 0.008%)   29010 ( 2.1%)   71.547     -2325.    -71.547      0.000      0.000      N/A
   7    2.0    14.9    0 5997765      21     142      80 ( 0.006%)   29113 ( 2.1%)   71.384     -2325.    -71.384      0.000      0.000      N/A
   8    1.9    19.3    0 5528622      11      73      47 ( 0.003%)   29186 ( 2.1%)   71.384     -2325.    -71.384      0.000      0.000      N/A
   9    1.2    25.1    0 3678610      13      77      30 ( 0.002%)   29222 ( 2.1%)   71.384     -2325.    -71.384      0.000      0.000      N/A
  10    0.6    32.6    0 1914258       6      36      18 ( 0.001%)   29258 ( 2.1%)   71.384     -2326.    -71.384      0.000      0.000       18
  11    0.9    42.4    0 2660424       6      31      21 ( 0.002%)   29371 ( 2.1%)   71.223     -2327.    -71.223      0.000      0.000       17
  12    0.4    55.1    0 1033415       5      18       9 ( 0.001%)   29375 ( 2.1%)   71.223     -2327.    -71.223      0.000      0.000       18
  13    0.3    71.7    0  792161       4      10      14 ( 0.001%)   29369 ( 2.1%)   71.384     -2327.    -71.384      0.000      0.000       18
  14    0.3    93.2    0  865134       5      23       3 ( 0.000%)   29441 ( 2.1%)   71.344     -2328.    -71.344      0.000      0.000       20
  15    0.1   121.1    0  114137       2       7       0 ( 0.000%)   29496 ( 2.1%)   71.344     -2328.    -71.344      0.000      0.000       18
Restoring best routing
Critical path: 71.3442 ns
Successfully routed after 15 routing iterations.
Final Net Connection Criticality Histogram:
[        0:      0.1) 757 ( 63.0%) |***********************************************
[      0.1:      0.2)   0 (  0.0%) |
[      0.2:      0.3)  41 (  3.4%) |***
[      0.3:      0.4)  40 (  3.3%) |**
[      0.4:      0.5)  36 (  3.0%) |**
[      0.5:      0.6)  35 (  2.9%) |**
[      0.6:      0.7)  27 (  2.2%) |**
[      0.7:      0.8)  69 (  5.7%) |****
[      0.8:      0.9)  77 (  6.4%) |*****
[      0.9:        1) 119 (  9.9%) |*******
Router Stats: total_nets_routed: 486 total_connections_routed: 3634 total_heap_pushes: 104187883 total_heap_pops: 87796622
# Routing took 36.19 seconds (max_rss 450.3 MiB, delta_rss +58.5 MiB)

Checking to ensure routing is legal...
Completed routing consistency check successfully.

Serial number (magic cookie) for the routing is: -497680912
Circuit successfully routed with a channel width factor of 100.

Incr Slack updates 16 in 0.00042146 sec
Full Max Req/Worst Slack updates 5 in 3.3176e-05 sec
Incr Max Req/Worst Slack updates 11 in 5.2814e-05 sec
Incr Criticality updates 6 in 0.000130989 sec
Full Criticality updates 10 in 0.00023698 sec

Average number of bends per net: 225.540  Maximum # of bends: 6641

Number of global nets: 0
Number of routed nets (nonglobal): 113
Wire length results (in units of 1 clb segments)...
	Total wirelength: 28639, average net length: 253.442
	Maximum net length: 8560

Wire length results in terms of physical segments...
	Total wiring segments used: 25988, average wire segments per net: 229.982
	Maximum segments used by a net: 6843
	Total local nets with reserved CLB opins: 0

Routing channel utilization histogram:
[        1:      inf)    0 (  0.0%) |
[      0.9:        1)   54 (  2.1%) |*
[      0.8:      0.9)    0 (  0.0%) |
[      0.7:      0.8)    6 (  0.2%) |
[      0.5:      0.6)    0 (  0.0%) |
[      0.4:      0.5)    0 (  0.0%) |
[      0.3:      0.4)    8 (  0.3%) |
[      0.2:      0.3)   76 (  2.9%) |*
[      0.1:      0.2)   66 (  2.6%) |*
[        0:      0.1) 2374 ( 91.9%) |**********************************************
Maximum routing channel utilization:         1 at (1,3)

X - Directed channels:   j max occ ave occ capacity
                      ---- ------- ------- --------
                         0       2   1.231        2
                         1     161  10.026      221
                         2       0   0.000        0
                         3      91  21.692      635
                         4      68   2.615      623
                         5      70   3.923      658
                         6      78   2.282      623
                         7      77   3.154      623
                         8      28   1.949      623
                         9     203  27.872      623
                        10     251  39.615      665
                        11     241  35.872      623
                        12     219  33.744      647
                        13     202  35.949      623
                        14     229  46.641      623
                        15     217  43.513      623
                        16     195  35.615      623
                        17     174  18.359      623
                        18       0   0.000      725
                        19       0   0.000      623
                        20       0   0.000      623
                        21       0   0.000      623
                        22       0   0.000      623
                        23       0   0.000      623
                        24       0   0.000      623
                        25       0   0.000      657
                        26       0   0.000      634
                        27       0   0.000      623
                        28       0   0.000      623
                        29       0   0.000      624
                        30       0   0.000      625
                        31       0   0.000      626
                        32       0   0.000      786
                        33       0   0.000      269
Y - Directed channels:   i max occ ave occ capacity
                      ---- ------- ------- --------
                         0       0   0.000        2
                         1      47   4.057      287
                         2       1   0.029        4
                         3     177  53.857      848
                         4      36   1.943      874
                         5      54   2.429      819
                         6      30   5.571      760
                         7      46   3.771      761
                         8      11   1.314      761
                         9      46   4.057      761
                        10      25   3.343      757
                        11     175  18.257      775
                        12     204  22.714      757
                        13     216  24.457      761
                        14     215  38.314      761
                        15     221  38.686      761
                        16     198  37.000      761
                        17     237  41.857      761
                        18     237  43.943      761
                        19     238  38.029      816
                        20     191  24.000      761
                        21      12   0.943      883
                        22       9   0.571      761
                        23       0   0.000      761
                        24      30   2.343      761
                        25       0   0.000      761
                        26      30   1.114      757
                        27       0   0.000      775
                        28       0   0.000      757
                        29       0   0.000      761
                        30       0   0.000      761
                        31       0   0.000      761
                        32       0   0.000      761
                        33       0   0.000      763
                        34       0   0.000      762
                        35       0   0.000      764
                        36       0   0.000     1024
                        37       0   0.000      164

Total tracks in x-direction: 19611, in y-direction: 27046

Logic area (in minimum width transistor areas, excludes I/Os and empty grid tiles)...
	Total logic block area (Warning, need to add pitch of routing to blocks with height > 3): 1.3515e+07
	Total used logic block area: 975000

Routing area (in minimum width transistor areas)...
	Assuming no buffer sharing (pessimistic). Total: 1.07847e+09, per logic tile: 790090.
	Assuming buffer sharing (slightly optimistic). Total: 8.38760e+08, per logic tile: 614476.


Segment usage by type (index):    name type utilization
                               ------- ---- -----------
                                  sbox    2      0.0169
                                   vcc    3      0.0839
                                   gnd    4      0.0967
                                  hop1    5      0.0212
                                  hop2    6      0.0265
                                  hop3    7      0.0128
                                  hop4    8      0.0122
                                 clock    9           0
                               special   10      0.0828

Segment usage by length: length utilization
                         ------ -----------
                              1      0.0174
                              2      0.0265
                              3      0.0128
                              4      0.0122


Final hold Worst Negative Slack (hWNS): 0 ns
Final hold Total Negative Slack (hTNS): 0 ns

Final hold slack histogram:
[  4.2e-09:    8e-09) 14 ( 37.8%) |************************************************
[    8e-09:  1.2e-08) 14 ( 37.8%) |************************************************
[  1.2e-08:  1.5e-08)  2 (  5.4%) |*******
[  1.5e-08:  1.9e-08)  0 (  0.0%) |
[  1.9e-08:  2.3e-08)  0 (  0.0%) |
[  2.3e-08:  2.7e-08)  0 (  0.0%) |
[  2.7e-08:    3e-08)  0 (  0.0%) |
[    3e-08:  3.4e-08)  0 (  0.0%) |
[  3.4e-08:  3.8e-08)  3 (  8.1%) |**********
[  3.8e-08:  4.1e-08)  4 ( 10.8%) |**************

Final critical path delay (least slack): 71.3053 ns, Fmax: 14.0242 MHz
Final setup Worst Negative Slack (sWNS): -71.3053 ns
Final setup Total Negative Slack (sTNS): -2327.36 ns

Final setup slack histogram:
[ -7.1e-08: -6.9e-08)  2 (  5.4%) |********
[ -6.9e-08: -6.7e-08)  2 (  5.4%) |********
[ -6.7e-08: -6.5e-08)  2 (  5.4%) |********
[ -6.5e-08: -6.3e-08)  9 ( 24.3%) |************************************
[ -6.3e-08: -6.2e-08) 12 ( 32.4%) |************************************************
[ -6.2e-08:   -6e-08)  5 ( 13.5%) |********************
[   -6e-08: -5.8e-08)  2 (  5.4%) |********
[ -5.8e-08: -5.6e-08)  0 (  0.0%) |
[ -5.6e-08: -5.4e-08)  2 (  5.4%) |********
[ -5.4e-08: -5.2e-08)  1 (  2.7%) |****

Final geomean non-virtual intra-domain period: 71.3053 ns (14.0242 MHz)
Final fanout-weighted geomean non-virtual intra-domain period: 71.3053 ns (14.0242 MHz)

Incr Slack updates 1 in 2.6563e-05 sec
Full Max Req/Worst Slack updates 1 in 7.188e-06 sec
Incr Max Req/Worst Slack updates 0 in 0 sec
Incr Criticality updates 0 in 0 sec
Full Criticality updates 1 in 2.5625e-05 sec
Flow timing analysis took 0.0130206 seconds (0.0114403 STA, 0.00158026 slack) (17 full updates: 0 setup, 0 hold, 17 combined).
VPR succeeded
The entire flow of VPR took 64.37 seconds (max_rss 450.3 MiB)
